{
  "$schema": "https://json-schema.org/draft/2020-12/schema",
  "title": "VespertideConfig",
  "description": "Top-level vespertide configuration.",
  "type": "object",
  "properties": {
    "columnNamingCase": {
      "$ref": "#/$defs/NameCase"
    },
    "lockTimeoutMs": {
      "description": "Maximum time (milliseconds) to wait acquiring a lock during a runtime\nmigration before failing. When set, the `vespertide_migration!` macro\nemits a backend-appropriate session/connection timeout at the start of\nthe migration (`PostgreSQL` `lock_timeout`, `MySQL`\n`innodb_lock_wait_timeout`, `SQLite` `PRAGMA busy_timeout`). `None`\n(default) leaves backend defaults untouched. Absent from serialized\nJSON when `None` (wire-compatible).",
      "type": [
        "integer",
        "null"
      ],
      "format": "uint64",
      "minimum": 0
    },
    "migrationFilenamePattern": {
      "type": "string",
      "default": "%04v_%m"
    },
    "migrationFormat": {
      "$ref": "#/$defs/FileFormat",
      "default": "json"
    },
    "migrationsDir": {
      "type": "string"
    },
    "modelExportDir": {
      "description": "Output directory for generated ORM models.",
      "type": "string",
      "default": "src/models"
    },
    "modelFormat": {
      "$ref": "#/$defs/FileFormat",
      "default": "json"
    },
    "modelsDir": {
      "type": "string"
    },
    "prefix": {
      "description": "Prefix to add to all table names (including migration version table).\nDefault: \"\" (no prefix)",
      "type": "string",
      "default": ""
    },
    "prisma": {
      "description": "Prisma-specific export configuration.",
      "$ref": "#/$defs/PrismaConfig",
      "default": {
        "provider": "postgresql"
      }
    },
    "seaorm": {
      "description": "SeaORM-specific export configuration.",
      "$ref": "#/$defs/SeaOrmConfig",
      "default": {
        "enumNamingCase": "camel",
        "extraEnumDerives": [
          "vespera::Schema"
        ],
        "extraModelDerives": [],
        "vesperaSchemaType": true
      }
    },
    "statementTimeoutMs": {
      "description": "Maximum time (milliseconds) a single migration statement may run before\nthe backend aborts it. When set, the macro emits `PostgreSQL`\n`statement_timeout` / `MySQL` `max_execution_time`. `SQLite` has no\nstatement timeout, so this is skipped there. `None` (default) leaves\nbackend defaults untouched. Absent from serialized JSON when `None`.",
      "type": [
        "integer",
        "null"
      ],
      "format": "uint64",
      "minimum": 0
    },
    "tableNamingCase": {
      "$ref": "#/$defs/NameCase"
    }
  },
  "required": [
    "modelsDir",
    "migrationsDir",
    "tableNamingCase",
    "columnNamingCase"
  ],
  "$defs": {
    "FileFormat": {
      "description": "Supported file formats for generated artifacts.",
      "type": "string",
      "enum": [
        "json",
        "yaml",
        "yml"
      ]
    },
    "NameCase": {
      "description": "Supported naming cases.",
      "type": "string",
      "enum": [
        "snake",
        "camel",
        "pascal"
      ]
    },
    "PrismaConfig": {
      "description": "Prisma-specific export configuration.",
      "type": "object",
      "properties": {
        "clientOutput": {
          "description": "Optional output path for the generated Prisma client.",
          "type": [
            "string",
            "null"
          ]
        },
        "provider": {
          "description": "Database provider: postgresql, mysql, sqlite, sqlserver, mongodb, cockroachdb.",
          "type": "string",
          "default": "postgresql"
        },
        "relationMode": {
          "description": "Optional relationMode override (\"foreignKeys\" or \"prisma\").",
          "type": [
            "string",
            "null"
          ]
        }
      }
    },
    "SeaOrmConfig": {
      "description": "SeaORM-specific export configuration.",
      "type": "object",
      "properties": {
        "enumNamingCase": {
          "description": "Naming case for serde `rename_all` attribute on generated enums.\nDefault: `Camel` (generates `#[serde(rename_all = \"camelCase\")]`)",
          "$ref": "#/$defs/NameCase",
          "default": "camel"
        },
        "extraEnumDerives": {
          "description": "Additional derive macros to add to generated enum types.\nDefault: `[\"vespera::Schema\"]`",
          "type": "array",
          "default": [
            "vespera::Schema"
          ],
          "items": {
            "type": "string"
          }
        },
        "extraModelDerives": {
          "description": "Additional derive macros to add to generated entity model types.",
          "type": "array",
          "default": [],
          "items": {
            "type": "string"
          }
        },
        "vesperaSchemaType": {
          "description": "Generate `vespera::schema_type!` macro invocation for each entity.\nDefault: `true`",
          "type": "boolean",
          "default": true
        }
      }
    }
  }
}