{
  "modelsDir": "examples/app/models",
  "migrationsDir": "migrations",
  "tableNamingCase": "snake",
  "columnNamingCase": "snake",
  "modelFormat": "json",
  "migrationFormat": "json",
  "migrationFilenamePattern": "%04v_%m",
  "modelExportDir": "src/models",
  "seaorm": {
    "extraEnumDerives": [
      "vespera::Schema"
    ],
    "extraModelDerives": [],
    "enumNamingCase": "camel",
    "vesperaSchemaType": true
  },
  "prefix": ""
}